date,ticker,headline,source,url
2026-05-23,AAPL,"If I could buy only one ASX ETF for the next 10 years, this could be it",Motley Fool Australia,https://www.fool.com.au/2026/05/24/if-i-could-buy-only-one-asx-etf-for-the-next-10-years-this-could-be-it/
2026-05-23,AAPL,Paul Tudor Jones makes $8 billion bet on small-cap chaos,TheStreet,https://www.thestreet.com/investing/paul-tudor-jones-makes-8-billion-bet-on-small-cap-chaos
2026-05-23,AAPL,Apple Inc. (AAPL)’s Durable Growth Narrative Keeps Getting Stronger,Yahoo Entertainment,https://consent.yahoo.com/v2/collectConsent?sessionId=1_cc-session_1f7b11f7-22ee-43d3-a9ab-b3f01908a7ab
2026-05-23,AAPL,MarketBeat Week in Review – 05/18 - 05/22,MarketBeat,https://www.marketbeat.com/originals/marketbeat-week-in-review-05-18-05-22/?utm_source=yahoofinance&amp;utm_medium=yahoofinance
2026-05-23,AAPL,ACASIS、Apple M1/M2チップ搭載の旧Mac miniを収納しUSB-AやNVMe SSDを搭載できるThunderbolt(40Gbps)対応ドック「Acasis Mac mini M2 Dock & Stand」を発売。,Applech2.com,https://applech2.com/archives/20260523-acasis-mac-mini-intel-m2-dock-and-stand.html
2026-05-22,AAPL,Microsoft vs. Apple Stock: The Numbers Reveal a Clear Winner Heading Into H2 2026,Barchart.com,https://www.barchart.com/story/news/2095554/microsoft-vs-apple-stock-the-numbers-reveal-a-clear-winner-heading-into-h2-2026
2026-05-22,AAPL,‘Buffett Indicator’ warns of a market top — 8 crucial signs that stocks are running on fumes,MarketWatch,https://www.marketwatch.com/story/buffett-indicator-warns-of-a-market-top-8-crucial-signs-that-stocks-are-running-on-fumes-12e4b4d8
2026-05-22,AAPL,Apple shares hit new all-time intraday and closing highs,Macdailynews.com,https://macdailynews.com/2026/05/22/apple-shares-hit-new-all-time-intraday-and-closing-highs-93/
2026-05-22,ABBV,AbbVie Announces Positive CHMP Opinion for MAVIRET® (glecaprevir/pibrentasvir) for the Treatment of Acute Hepatitis C Infection,PRNewswire,https://www.prnewswire.com/news-releases/abbvie-announces-positive-chmp-opinion-for-maviret-glecaprevirpibrentasvir-for-the-treatment-of-acute-hepatitis-c-infection-302779052.html
2026-05-22,ABBV,Best Stocks To Buy Now For June 2026,Forbes,https://www.forbes.com/sites/investor-hub/article/best-stocks-to-buy-now-june-2026/
2026-05-21,ABBV,AbbVie Announces New Data at ASCO 2026 Demonstrating Breadth and Momentum Across its Next-Generation Oncology Pipeline,PRNewswire,https://www.prnewswire.com/news-releases/abbvie-announces-new-data-at-asco-2026-demonstrating-breadth-and-momentum-across-its-next-generation-oncology-pipeline-302779632.html
2026-05-21,ABBV,Allergan Aesthetics Receives Positive CHMP Opinion for Boey® (TrenibotulinumtoxinE) for the Temporary Improvement of Moderate to Severe Glabellar Lines in Adults,PRNewswire,https://www.prnewswire.com/news-releases/allergan-aesthetics-receives-positive-chmp-opinion-for-boey-trenibotulinumtoxine-for-the-temporary-improvement-of-moderate-to-severe-glabellar-lines-in-adults-302779498.html
2026-05-21,ABBV,5 Best Dividend Stocks Now To Buy For June 2026,Forbes,https://www.forbes.com/sites/investor-hub/article/best-dividend-stocks-buy-june-2026/
2026-05-21,ABBV,AbbVie Inc. (ABBV) Positioned for Long-Term Gains with IBD Pipeline Strength,Yahoo Entertainment,https://consent.yahoo.com/v2/collectConsent?sessionId=1_cc-session_4fc0deec-d002-4db8-a341-e46091464b7b
2026-05-19,ABBV,Ditch or Double Down on This Pharma ETF as Trump Adjusts Drug Prices?,24/7 Wall St.,https://247wallst.com/investing/2026/05/19/ditch-or-double-down-on-this-pharma-etf-as-trump-adjusts-drug-prices/
2026-05-19,ABBV,AbbVie (ABBV) Price Target Lowered to $235 at Evercore ISI,Yahoo Entertainment,https://consent.yahoo.com/v2/collectConsent?sessionId=1_cc-session_3dadcf8a-153a-43fc-92e5-a426e3ed22db
2026-05-23,ABT,DTM Zandvoort: Cairoli takes maiden win as Auer grabs championship lead,autosport.com,https://www.autosport.com/dtm/news/dtm-zandvoort-race-1-cairoli-takes-maiden-win-as-auer-takes-championship-lead/10823361/
2026-05-23,ABT,DTM Zandvoort Race 1: Cairoli takes maiden win as Auer takes championship lead,Motorsport.com,https://www.motorsport.com/dtm/news/dtm-race-at-zandvoort-1-ferrari-driver-cairoli-celebrates-victory-timo-glock-unlucky/10823354/
2026-05-23,ABT,Kathy Griffin Shares She Was Hospitalized Over Complications From Colonoscopy,Freerepublic.com,https://freerepublic.com/focus/f-chat/4380579/posts
2026-05-22,ABT,"Dinner, Dance and Devotion: Inside American Ballet Theatre’s Glittering Spring Gala",Observer,https://observer.com/2026/05/photos-abt-spring-gala-cipriani-katie-holmes-ballet-dance/
2026-05-21,ABT,5k-Mile 2021 Audi RS7-R,Bringatrailer.com,https://bringatrailer.com/listing/2021-audi-rs7-24/
2026-05-21,ABT,Katie Holmes and mom Kathleen twin in distinct dresses for a chic city night out - HOLA,Slashdot.org,https://slashdot.org/firehose.pl?op=view&amp;id=183314402
2026-05-21,ABT,Katie Holmes & Her Mom Make Rare Joint Appearance at ABT Gala,Eonline.com,https://www.eonline.com/news/1432234/katie-holmes-mom-kathleen-holmes-make-rare-appearance-at-abt-gala
2026-05-21,ABT,Katie Holmes Shows How to Wear Thong Sandals on the Red Carpet at the American Ballet Theatre’s Spring Gala,WWD,http://wwd.com/footwear-news/shoe-trends/katie-holmes-herbert-levine-thong-sandals-abt-spring-gala-1238977310/
2026-05-22,AEP,aepp 0.5.6.post1,Pypi.org,https://pypi.org/project/aepp/0.5.6.post1/
2026-05-22,AEP,py-aep 0.8.2,Pypi.org,https://pypi.org/project/py-aep/0.8.2/
2026-05-20,AEP,runtimeai-aep added to PyPI,Pypi.org,https://pypi.org/project/runtimeai-aep/
2026-05-20,AEP,runtimeai-aep 1.0.0,Pypi.org,https://pypi.org/project/runtimeai-aep/1.0.0/
2026-05-20,AEP,aepp 0.5.6,Pypi.org,https://pypi.org/project/aepp/0.5.6/
2026-05-20,AEP,NBB Expands into Auto Services M&A with Addition of Two Experienced Investment Banking Leaders,GlobeNewswire,https://www.globenewswire.com/news-release/2026/05/20/3298454/0/en/NBB-Expands-into-Auto-Services-M-A-with-Addition-of-Two-Experienced-Investment-Banking-Leaders.html
2026-05-20,AEP,TD Cowen Sees More Growth Ahead for American Electric Power (AEP),Yahoo Entertainment,https://consent.yahoo.com/v2/collectConsent?sessionId=1_cc-session_20948af5-ea4c-4a3a-80fa-e6d78247901c
2026-05-20,AEP,Indonesia’s Radical Export Experiment Upends Its Commodity Trade,Financial Post,https://financialpost.com/pmn/business-pmn/indonesias-radical-export-experiment-upends-its-commodity-trade
2026-05-24,AMD,breccia added to PyPI,Pypi.org,https://pypi.org/project/breccia/
2026-05-24,AMD,The C++ Standard Library Has Been Walking Itself Back for Fifteen Years,Hftuniversity.com,https://hftuniversity.com/post/the-c-standard-library-has-been-walking-itself-back-for-fifteen-years-and-the-receipts-are-public
2026-05-23,AMD,Corsair has started sourcing Chinese RAM,Notebookcheck.net,https://www.notebookcheck.net/Corsair-has-started-sourcing-Chinese-RAM.1304222.0.html
2026-05-23,AMD,NVIDIA's 'Vera' CPUs could outperform and outsell competing x86 offerings from Intel and AMD,TweakTown,https://www.tweaktown.com/news/111785/nvidias-vera-cpus-could-outperform-and-outsell-competing-x86-offerings-from-intel-and-amd/index.html
2026-05-23,AMD,Adobe Photoshop 2026 v27.7 Win x64,Cgpersia.com,https://cgpersia.com/2026/05/adobe-photoshop-2026-v27-7-win-x64-203422.html
2026-05-23,AMD,AMD (Xilinx) is Excluding Linux From the Free Tier For Its FPGA Dev Tool,Slashdot.org,https://hardware.slashdot.org/story/26/05/23/1917255/amd-xilinx-is-excluding-linux-from-the-free-tier-for-its-fpga-dev-tool
2026-05-23,AMD,Petter Reinholdtsen: Command line Norse God of Wind Hræsvelg move the clouds,Hungry.com,http://www.hungry.com/~pere/blog/Command_line_Norse_God_of_Wind_Hr_svelg_move_the_clouds.html
2026-05-23,AMD,AMD (AMD) Announces $10B Investment in Taiwan AI Infrastructure,Yahoo Entertainment,https://finance.yahoo.com/sectors/technology/articles/amd-amd-announces-10b-investment-201026402.html
2026-05-22,AMT,Leeds thrash Giants to reclaim Super League top spot,BBC News,https://www.bbc.com/sport/rugby-league/articles/cn8p1peqw9zo?xtor=AL-72-%5Bpartner%5D-%5Byahoo.north.america%5D-%5Bheadline%5D-%5Bsport%5D-%5Bbizdev%5D-%5Bisapi%5D
2026-05-22,AMT,"AllianceBernstein National Municipal Income Fund, Inc. RELEASES MONTHLY PORTFOLIO UPDATE",PRNewswire,https://www.prnewswire.com/news-releases/alliancebernstein-national-municipal-income-fund-inc-releases-monthly-portfolio-update-302780333.html
2026-05-22,AMT,"$500,000 in These 3 Tax Free Bond ETFs Pays $1,750 a Month for High Income Retirees",24/7 Wall St.,https://247wallst.com/investing/2026/05/22/500000-in-these-3-tax-free-bond-etfs-pays-1750-a-month-for-high-income-retirees/
2026-05-21,AMT,Priming iTBS for lower limb rehabilitation after stroke: Protocol for a randomized controlled trial on efficacy and neuroplasticity,Plos.org,https://journals.plos.org/plosone/article?id=10.1371/journal.pone.0349578
2026-05-20,AMT,"Why AST SpaceMobile Is the Bigger Winner of the AT&T, T-Mobile, and Verizon Joint Venture",MarketBeat,https://www.marketbeat.com/stock-ideas/why-ast-spacemobile-is-the-bigger-winner-of-the-at-and-t-t-mobile-and-verizon-joint-venture/?utm_source=yahoofinance&amp;utm_medium=yahoofinance
2026-05-20,AMT,Considering Uniqure NV (QURE) Stock? Read the AMT-130 Message,Yahoo Entertainment,https://consent.yahoo.com/v2/collectConsent?sessionId=1_cc-session_f9b699d6-701a-4d55-8c92-87988fd34931
2026-05-20,AMT,A pathogen lncRNA secreted into rice sequesters a host miRNA for virulence,Nature.com,https://www.nature.com/articles/s41586-026-10572-x
2026-05-19,AMT,"Here Are Tuesday’s Top Wall Street Analyst Research Calls: American Tower, Citigroup, CrowdStrike, Fortinet, Hanover Insurance, Jazz Pharmaceuticals, Stubhub, X-Energy, and More",24/7 Wall St.,https://247wallst.com/investing/2026/05/19/here-are-tuesdays-top-wall-street-analyst-research-calls-american-tower-citigroup-crowdstrike-fortinet-hanover-insurance-jazz-pharmaceuticals-stubhub-x-energy-and-more/
2026-05-24,AMZN,Skeet 2024 1080p AMZN WEB-DL H264-DAiR,Rlsbb.to,https://post.rlsbb.to/skeet-2024-1080p-amzn-web-dl-h264-dair/
2026-05-24,AMZN,Duse 2025 720p AMZN WEB-DL H264-MADSKY,Rlsbb.to,https://post.rlsbb.to/duse-2025-720p-amzn-web-dl-h264-madsky/
2026-05-24,AMZN,Security Hub CSPM に集約した GuardDuty の検知を DevOps Agent で調査し Slack 通知までを試してみた,Classmethod.jp,https://dev.classmethod.jp/articles/devops-agent-investigate-guardduty-findings/
2026-05-23,AMZN,Bonolota Express 2026 1080p AMZN WEB-DL H264-MosharrafTheGoat,Rlsbb.to,https://post.rlsbb.to/bonolota-express-2026-1080p-amzn-web-dl-h264-mosharrafthegoat/
2026-05-23,AMZN,Marlee Matlin Not Alone Anymore 2025 1080p AMZN WEB-DL H264-MADSKY,Rlsbb.to,https://post.rlsbb.to/marlee-matlin-not-alone-anymore-2025-1080p-amzn-web-dl-h264-madsky/
2026-05-23,AMZN,Paul Tudor Jones makes $8 billion bet on small-cap chaos,TheStreet,https://www.thestreet.com/investing/paul-tudor-jones-makes-8-billion-bet-on-small-cap-chaos
2026-05-23,AMZN,Our Italian Christmas Memories 2022 1080p AMZN WEB-DL H264-MERRY,Rlsbb.to,https://post.rlsbb.to/our-italian-christmas-memories-2022-1080p-amzn-web-dl-h264-merry/
2026-05-23,AMZN,Hayagrriva 2026 1080p AMZN WEB-DL H264-Rummy,Rlsbb.to,https://post.rlsbb.to/hayagrriva-2026-1080p-amzn-web-dl-h264-rummy/
2026-05-23,AVGO,Broadcom’s AI Packaging Bet Gets Bigger. Wall Street Is Betting on More Upside for AVGO Stock.,Barchart.com,https://www.barchart.com/story/news/2102972/broadcoms-ai-packaging-bet-gets-bigger-wall-street-is-betting-on-more-upside-for-avgo-stock
2026-05-23,AVGO,"These cybersecurity stocks are poised for rapid growth through 2028, and some of them are cheap right now",MarketWatch,https://www.marketwatch.com/story/these-cybersecurity-stocks-are-poised-for-rapid-growth-through-2028-and-some-of-them-are-cheap-right-now-cf924a36
2026-05-22,AVGO,SMH vs SOXX: Which Semiconductor ETF Should You Buy in 2026?,Etf.com,http://www.etf.com/sections/news/smh-vs-soxx-which-semiconductor-etf-should-you-buy-2026?utm_source=yahoo-finance&amp;utm_medium=rss&amp;utm_campaign=yahoo-finance-rss
2026-05-22,AVGO,Inflation Fears Weighed on Broadcom (AVGO) in Q1,Yahoo Entertainment,https://finance.yahoo.com/markets/stocks/articles/inflation-fears-weighed-broadcom-avgo-132922719.html
2026-05-22,AVGO,The Best AI Stock to Buy Now for Less Than $500,Barchart.com,https://www.barchart.com/story/news/2082392/the-best-ai-stock-to-buy-now-for-less-than-500
2026-05-21,AVGO,Is Broadcom (AVGO) The Best AI Chip Stock to Buy?,Yahoo Entertainment,https://finance.yahoo.com/sectors/technology/articles/broadcom-avgo-best-ai-chip-161307258.html
2026-05-21,AVGO,"Jim Cramer froze on live TV after seeing Trump's 3,700 stock trades — here's what's in the president's portfolio",Yahoo Entertainment,https://finance.yahoo.com/markets/stocks/articles/jim-cramer-froze-on-live-tv-after-seeing-trump39s-3700-stock-trades--here39s-what39s-in-the-president39s-portfolio-140000901.html
2026-05-21,AVGO,"Jim Cramer froze on live TV after seeing Trump's 3,700 stock trades — here's what's in the president's portfolio",Yahoo Entertainment,https://finance.yahoo.com/markets/stocks/articles/jim-cramer-froze-live-tv-140000925.html
2026-05-24,BABA,Two Future Spartans Remain in the Running for Team USA U19 Roster,Roundtable.io,https://roundtable.io/sports/ncaa/michigan-state/news/two-future-spartans-remain-in-the-running-for-team-usa-u19-roster
2026-05-23,BABA,Of the consensually sidelined,The Punch,https://punchng.com/of-the-consensually-sidelined/
2026-05-23,BABA,Hera Pheri 3 controversy: Has Paresh Rawal returned the signing amount he got? Here is what happened,The Times of India,https://economictimes.indiatimes.com/magazines/panache/hera-pheri-3-controversy-has-paresh-rawal-returned-the-signing-amount-he-got-here-is-what-happened/articleshow/131282010.cms
2026-05-23,BABA,'A new kind of war': Inside Ukraine's hidden factories mass-producing combat drones,Fox News,https://www.foxnews.com/world/a-new-kind-war-inside-ukraines-hidden-factories-mass-producing-combat-drones
2026-05-23,BABA,Alibaba (BABA) Unveils Zhenwu M890 AI Chip for Autonomous Agents,Yahoo Entertainment,https://consent.yahoo.com/v2/collectConsent?sessionId=1_cc-session_bd878e04-393a-479c-a56f-0ab96008c1a8
2026-05-23,BABA,Captured Ukrainian Baba Yagas Are Becoming Russia’s Drone Of Choice,Forbes,https://www.forbes.com/sites/vikrammittal/2026/05/23/captured-ukrainian-baba-yagas-are-becoming-russias-drone-of-choice/
2026-05-23,BABA,"'Here is your bride... please don't beat her': As Taliban recognises child marriage, Afghans 'marry off' girls and BABIES - and can only hope they are not raped before they even hit puberty",Dailymail.com,https://www.dailymail.com/news/article-15834585/Here-bride-dont-beat-Taliban-recognises-child-marriage-Afghans-marry-girls-BABIES-hope-not-raped-hit-puberty.html
2026-05-23,BABA,Before Stardom With… Adewumi Oluwole Adegoke (Mr Allwell),The Punch,https://punchng.com/before-stardom-with-adewumi-oluwole-adegoke-mr-allwell/
2026-05-22,BAC,A murine cytomegalovirus cell cycle regulator (m54.5p) evolved within the conserved viral DNA polymerase gene,Plos.org,https://journals.plos.org/plospathogens/article?id=10.1371/journal.ppat.1013424
2026-05-22,BAC,How ‘zebra striping’ on a night out can help you drink less – and potentially avoid a hangover,The Conversation Africa,https://theconversation.com/how-zebra-striping-on-a-night-out-can-help-you-drink-less-and-potentially-avoid-a-hangover-282407
2026-05-21,BAC,$49* | Craftsman V20 Tire Inflator Portable Air Compressor (Tool Only) + 10% Back w/ Prime Visa Card at Amazon (1 replies),Slickdeals.net,https://slickdeals.net/f/19548465-49-craftsman-v20-tire-inflator-portable-air-compressor-tool-only-10-back-w-prime-visa-card-at-amazon
2026-05-21,BAC,“Cash in the Long Haul Is Trash”: Why This Money Expert Rejects Traditional Retirement Buckets,24/7 Wall St.,https://247wallst.com/investing/2026/05/21/cash-in-the-long-haul-is-trash-why-this-money-expert-rejects-traditional-retirement-buckets/
2026-05-21,BAC,Life Insurance Corporation profit rises 23 per cent in Q4FY26,The Indian Express,https://indianexpress.com/article/business/companies/life-insurance-corporation-profit-rises-23-per-cent-in-q4fy26-10702006/
2026-05-21,BAC,"LIC Q4 net up 23% on higher premium income, declares 1:1 bonus",BusinessLine,https://www.thehindubusinessline.com/money-and-banking/lic-net-up-23-pc-in-q4-on-higher-premium-income-declares-11-bonus/article71007224.ece
2026-05-21,BAC,Berkshire Hathaway Sold 16 Stocks in Q1 but Warren Buffett and Greg Abel Still Have 70% in Just 7 Stocks,24/7 Wall St.,https://247wallst.com/investing/2026/05/21/berkshire-hathaway-sold-16-stocks-in-q1-but-warren-buffett-and-greg-abel-still-have-70-in-7-stocks/
2026-05-21,BAC,"Occurrence, spatial distribution, and health risk of technology-critical elements in urban and industrial soils of Monterrey, Mexico: a first baseline investigation",Springer.com,https://link.springer.com/article/10.1007/s10653-026-03252-2
2026-05-21,BRK-B,Warren Buffett Just Dropped His Loudest Warning Yet: Berkshire’s Cash Position Hits All-Time High,24/7 Wall St.,https://247wallst.com/investing/2026/05/21/warren-buffett-just-dropped-his-loudest-warning-yet-berkshires-cash-position-hits-all-time-high/
2026-05-19,BRK-B,BNSF ops chief out after just five months,Yahoo Entertainment,https://finance.yahoo.com/markets/stocks/articles/bnsf-ops-chief-just-five-151400933.html
2026-05-18,BRK-B,UnitedHealth Group stock slides after Berkshire Hathaway exits position in the health insurer,Yahoo Entertainment,https://finance.yahoo.com/markets/stocks/article/unitedhealth-group-stock-slides-after-berkshire-hathaway-exits-position-in-the-health-insurer-130721003.html
2026-05-18,BRK-B,Greg Abel Channeled His Inner Warren Buffett With Legacy and Dividend Stock Buys in Q1,24/7 Wall St.,https://247wallst.com/investing/2026/05/18/greg-abel-channeled-his-inner-warren-buffett-with-legacy-and-dividend-stock-buys-in-q1/
2026-05-18,BRK-B,"Billionaire Bill Gates Dumps $2,228,403,000 in Microsoft and Warren Buffett’s Berkshire Hathaway",The Daily Hodl,https://dailyhodl.com/2026/05/18/billionaire-bill-gates-dumps-2228403000-in-microsoft-and-warren-buffetts-berkshire-hathaway/
2026-05-24,CAT,Manchester City vs Aston Villa – Predicted lineup and team news,The Football Faithful,https://thefootballfaithful.com/manchester-city-vs-aston-villa-predicted-lineup-and-team-news-2/
2026-05-24,CAT,My cat brought this into the house. What is it?,The Irish Times,https://www.irishtimes.com/life-style/2026/05/24/my-cat-brought-this-into-the-house-what-is-it/
2026-05-24,CAT,‘The only surprise is that you’re still cooking it’: There are reasons I stick to cooking just one dish,The Irish Times,https://www.irishtimes.com/life-style/people/2026/05/24/the-only-surprise-is-that-youre-still-cooking-it-there-are-reasons-i-stick-to-cooking-just-one-dish/
2026-05-24,CAT,Rachel Eliza Griffiths: ‘One of the gifts my mother gave me is I’m now not afraid to die’,The Irish Times,https://www.irishtimes.com/life-style/people/2026/05/24/rachel-eliza-griffiths-one-of-the-gifts-my-mother-gave-me-is-im-now-not-afraid-to-die/
2026-05-24,CAT,We are a society that cares...even about cats in dire peril,Americanthinker.com,https://www.americanthinker.com/blog/2026/05/we_are_a_society_that_cares_even_about_cats_in_dire_peril.html
2026-05-24,CAT,Weekly Update 24-May-2026,Nikonians.org,https://blog.nikonians.org/archives/2026/05/news_update_weekly_2026_05_24_194.html
2026-05-24,CAT,Cat Claw Nail Clippers (Pink) $2.99 + Free Shipping w/ Prime or on $35+,Slickdeals.net,https://slickdeals.net/f/19554633-cat-claw-nail-clippers-pink-2-99-free-shipping-w-prime-or-on-35
2026-05-24,CAT,Preppy Princeton killer who slayed brother and ate his eyeball found dead in jail cell,New York Post,https://nypost.com/2026/05/23/us-news/preppy-princeton-killer-who-slayed-brother-and-ate-his-eyeball-found-dead-in-jail-cell/
2026-05-24,CCI,NCLAT rejects pleas against Kerala's liquor procurement agency; upholds CCI order,The Times of India,https://economictimes.indiatimes.com/news/india/nclat-rejects-pleas-against-keralas-liquor-procurement-agency-upholds-cci-order/articleshow/131289059.cms
2026-05-23,CCI,Miriam Lord: Danny Healy-Rae looks very fresh for a man who saw Dev stand up to Churchill,The Irish Times,https://www.irishtimes.com/politics/2026/05/23/danny-healy-rae-looks-very-well-for-a-man-who-saw-dev-stand-up-to-churchill/
2026-05-22,CCI,Weekly Global IPv4 Routing Table Report,Seclists.org,https://seclists.org/nanog/2026/May/140
2026-05-22,CCI,CCI Projects offloads 60% of Skyleap project inventory in six months,BusinessLine,https://www.thehindubusinessline.com/news/real-estate/cci-projects-offloads-60-of-skyleap-project-inventory-in-six-months/article71010453.ece
2026-05-22,CCI,UPSC Prelims 2026 Revision Checklist: Top 30 Polity and Governance topics that aspirants should revisit,The Indian Express,https://indianexpress.com/article/upsc-current-affairs/upsc-essentials/upsc-prelims-2026-revision-checklist-polity-and-governance-topics-10702746/
2026-05-22,CCI,Calcutta HC refuses to order OpenAI to show IndiaMart links on ChatGPT: what this means,MediaNama.com,https://www.medianama.com/2026/05/223-calcutta-hc-rejects-indiamart-plea-against-chatgpt-link-exclusion/
2026-05-22,CCI,Competition watchdog flags treatment pricing issues at private hospitals in Delhi-NCR,The Times of India,https://economictimes.indiatimes.com/news/india/competition-watchdog-flags-treatment-pricing-issues-at-private-hospitals-in-delhi-ncr/articleshow/131262459.cms
2026-05-22,CCI,"Sensex today | Stock Market Highlights: Sensex rises 231 pts, Nifty ends at 23,719 led by banks, positive global cues",BusinessLine,https://www.thehindubusinessline.com/markets/sensex-nifty50-today-stock-market-highlights-22nd-may-2026/article71006112.ece
2026-05-24,COP,"Wife goes scorched earth on cop husband with divorce filings so scandalous he has now lost his job, as family's perfect life is shattered",Dailymail.com,https://www.dailymail.com/news/article-15837247/arkansas-divorce-battle-alana-austin-kennedy-racist-texts.html
2026-05-24,COP,"Trans woman charged with threatening cop’s wife on Long Island, police say",New York Post,https://nypost.com/2026/05/23/us-news/trans-woman-charged-with-threatening-cops-wife-on-long-island-police-say/
2026-05-24,COP,Wonkette Movie Night: Lake Placid,Wonkette.com,https://www.wonkette.com/p/wonkette-movie-night-lake-placid
2026-05-23,COP,‘Too Many Beasts’ Review: Sarah Arnold’s Rustic Crime Thriller Mixes New With the Old,TheWrap,https://www.thewrap.com/creative-content/movies/too-many-beasts-review-cannes-sarah-arnold/
2026-05-23,COP,"White House on lockdown after gunman brandishes pistol, fires multiple shots toward White House",Freerepublic.com,https://freerepublic.com/focus/f-news/4380675/posts
2026-05-23,COP,European review: Kane hits hat-trick as Bayern complete domestic double,101 Great Goals,https://www.101greatgoals.com/football/european-review-kane-hits-hat-trick-as-bayern-complete-domestic-double/
2026-05-23,COP,Netflix’s New 8-Part Crime Thriller With 92% on RT Is Great for Fans of The Wire (& It’s a Top 3 Hit),ComicBook.com,http://comicbook.com/tv-shows/feature/netflixs-new-8-part-crime-thriller-with-92-on-rt-is-great-for-fans-of-the-wire-its-a-top-3-hit/
2026-05-23,COP,"Sheriff Country Season 2: Release Date, Story, & Everything We Know",Screen Rant,https://screenrant.com/sheriff-country-season-2-explained/
2026-05-24,COST,Govt in 'advanced stage of consultation' on industry's demand for cotton import duty removal: Official,BusinessLine,https://www.thehindubusinessline.com/economy/agri-business/govt-in-advanced-stage-of-consultation-on-industrys-demand-for-cotton-import-duty-removal-official/article71016978.ece
2026-05-24,COST,NCLAT rejects pleas against Kerala's liquor procurement agency; upholds CCI order,The Times of India,https://economictimes.indiatimes.com/news/india/nclat-rejects-pleas-against-keralas-liquor-procurement-agency-upholds-cci-order/articleshow/131289059.cms
2026-05-24,COST,DeepSeek locks in 75% discount on V4-Pro AI model for developers,Nextbigwhat.com,https://nextbigwhat.com/deepseek-locks-in-75-discount-on-v4-pro-ai-model-for-developers/
2026-05-24,COST,‘My Hero Academia Final Season’ Lands Top Prize at 10th Annual Crunchyroll Anime Awards,Variety,https://variety.com/2026/tv/news/crunchyroll-anime-awards-winners-2026-my-hero-academia-1236757806/
2026-05-24,COST,ABL80 FLEX BASIC Version Blood Gas Analyzer,News-Medical.Net,https://www.news-medical.net/ABL80-FLEX-BASIC-Version-Blood-Gas-Analyzer-from-Radiometer
2026-05-24,COST,Why the stakes are so high for Spurs and West Ham,BBC News,https://www.bbc.com/sport/football/articles/cpqpyprner9o?xtor=AL-72-%5Bpartner%5D-%5Byahoo.north.america%5D-%5Bheadline%5D-%5Bsport%5D-%5Bbizdev%5D-%5Bisapi%5D
2026-05-24,COST,Mateus Fernandes and Ederson could both arrive this summer,The Peoples Person,https://thepeoplesperson.com/2026/05/24/mateus-fernandes-and-ederson-could-both-arrive-this-summer-310535/
2026-05-24,COST,Govt in 'advanced stage of consultation' on industry's demand for cotton import duty removal,The Times of India,https://economictimes.indiatimes.com/news/economy/foreign-trade/govt-in-advanced-stage-of-consultation-on-industrys-demand-for-cotton-import-duty-removal/articleshow/131288843.cms
2026-05-23,CVX,"Brent Crude Is Up 85% Since January. OXY, XOM, and CVX Are Playing It Very Differently.",Yahoo Entertainment,https://consent.yahoo.com/v2/collectConsent?sessionId=1_cc-session_1c3b30a9-a1a9-4f40-93e5-406ab75a0335
2026-05-22,CVX,Chevron Corporation (CVX) Gained Amid Rise in Commodity Prices,Yahoo Entertainment,https://consent.yahoo.com/v2/collectConsent?sessionId=1_cc-session_d9216854-0bdd-4dae-80f3-fa34e4ac70d8
